Name,Description,Latitude,Longitude,InfoURL,ImageURL
UCSB,A great Univeristy located along the California Coast!,34.416929,-119.845991,"https://en.wikipedia.org/wiki/University_of_California,_Santa_Barbara ",https://web.physics.ucsb.edu/~Women/images/ucsb-big.jpg
My home,My loving and comforting home in Isla Vista!,34.41206,-119.86803,https://www.zillow.com/homedetails/925-Camino-Lindo-Goleta-CA-93117/15913140_zpid/,https://photos.zillowstatic.com/fp/30501de0afdb3dcc570670f190f4eadf-uncropped_scaled_within_1536_1152.webp
Trader Joes,One of my favorite places to buy nourishing groceries.,34.44151,-119.82371,https://www.traderjoes.com/home,https://lh3.googleusercontent.com/p/AF1QipNppril-5RJvIfeSXu8GMuR58dmZopqF3yRnif9=s1360-w1360-h1020
Handlebar Coffee Roasters ,My roomates work and a great place to grab coffee.,34.436832,-119.7123746,https://handlebarcoffee.com,https://www.independent.com/wp-content/uploads/2018/01/03/20171229_Handlebar_Coffee_001.jpg
UCSB Recreation Center ,A gym with a casual and welcoming environment.,34.41901,-119.84628,https://recreation.ucsb.edu,https://www.news.ucsb.edu/file/2424/download?token=XmnB4SqF
Carriage House Apartments,My friends aparment where I spend a lot of my time.  ,34.41665,-119.84547,https://www.kamap.net,https://images1.apartments.com/i2/7Ch8w5bG-566DYR3qIbJHxsrwZ_HWpmPKcALBqBwJk8/111/carriage-house-goleta-ca-primary-photo.jpg